<?xml version="1.0" encoding="UTF-8"?>
<xs:schema xmlns:xs="http://www.w3.org/2001/XMLSchema">

  <!-- Root element -->
  <xs:element name="feedbacks">
    <xs:complexType>
      <xs:sequence>
        <xs:element name="feedback" maxOccurs="unbounded">
          <xs:complexType>
            <xs:sequence>
              <xs:element name="name" type="xs:string"/>
              <xs:element name="email" type="xs:string"/>
              <xs:element name="phone" type="xs:string"/>
              <xs:element name="message" type="xs:string"/>
              <xs:element name="rating" type="xs:integer"/>
            </xs:sequence>
            <xs:attribute name="c_id" type="xs:string" use="required"/>
          </xs:complexType>
        </xs:element>
      </xs:sequence>
    </xs:complexType>
  </xs:element>

</xs:schema>
